{
  "$schema": "https://json-schema.org/draft/2020-12/schema",
  "title": "Útiterv Studio central content",
  "type": "object",
  "required": [
    "schemaVersion",
    "appVersion",
    "modules"
  ],
  "properties": {
    "schemaVersion": {
      "type": "integer"
    },
    "appVersion": {
      "type": "string"
    },
    "generatedFrom": {
      "type": "string"
    },
    "modules": {
      "type": "object"
    }
  },
  "additionalProperties": true
}
